{
  "schema": "r9v.runtime.v1",
  "id": "qwen38-flash-next-gfx1201-v1",
  "engine": "vllm-rocm",
  "targets": ["gfx1201"],
  "capabilities": {
    "model_architectures": ["qwen4_exp"],
    "api": "OpenAI-compatible",
    "tensor_parallel": [2],
    "vision": true,
    "mtp": true,
    "ssd_ple": true,
    "tiered_experts": true,
    "target_qtypes": ["IQ3_S", "IQ4_XS", "IQ4_NL", "Q8_0"],
    "context_tokens": 131072
  },
  "source": {
    "vllm_revision": "0c4efde1635edd52624bc60e52655a471b1bdc8a",
    "gguf_plugin_revision": "566bbc0cd0fc873c425e9a2c4112cb21b30354b1",
    "kernel_revision": "0a466fb35bf29323f29f55c3800c405141299865"
  },
  "safety": {
    "r4d": "hard-disabled",
    "display_gpu_headroom_required": true,
    "profile_compatibility_is_fail_closed": true
  }
}
